{"$schema":"https://json-schema.org/draft/2020-12/schema","title":"ObservationPacket","type":"object","required":["type","run_id","tool","summary","hidden_from_model"],"properties":{"type":{"const":"observation_packet.v1"},"run_id":{"type":"string"},"tool":{"type":"string"},"execution":{"type":"object"},"summary":{"type":"string"},"top_findings":{"type":"array"},"new_assets":{"type":"array"},"new_services":{"type":"array"},"new_endpoints":{"type":"array"},"recommended_next_actions":{"type":"array"},"hidden_from_model":{"type":"object"},"budget":{"type":"object"}}}
